{"pedido":"85951917582","data":"05/08/2026","clienteCodigo":"1710","clienteNome":"MV PRINTS LTDA","produtos":[{"tecidoCodigo":"1416","tecidoNome":"TRICOLINE","estampa":"6162","variante":"A"},{"tecidoCodigo":"1416","tecidoNome":"TRICOLINE","estampa":"6162","variante":"D"},{"tecidoCodigo":"1416","tecidoNome":"TRICOLINE","estampa":"6163","variante":"B"},{"tecidoCodigo":"1416","tecidoNome":"TRICOLINE","estampa":"6163","variante":"C"},{"tecidoCodigo":"1416","tecidoNome":"TRICOLINE","estampa":"6165","variante":"A"},{"tecidoCodigo":"1416","tecidoNome":"TRICOLINE","estampa":"6165","variante":"B"},{"tecidoCodigo":"1416","tecidoNome":"TRICOLINE","estampa":"6165","variante":"D"},{"tecidoCodigo":"1416","tecidoNome":"TRICOLINE","estampa":"6166","variante":"A"},{"tecidoCodigo":"1416","tecidoNome":"TRICOLINE","estampa":"6166","variante":"B"},{"tecidoCodigo":"1416","tecidoNome":"TRICOLINE","estampa":"6166","variante":"C"},{"tecidoCodigo":"1416","tecidoNome":"TRICOLINE","estampa":"6168","variante":"A"},{"tecidoCodigo":"1416","tecidoNome":"TRICOLINE","estampa":"6168","variante":"C"},{"tecidoCodigo":"1416","tecidoNome":"TRICOLINE","estampa":"6169","variante":"A"}]}
